{"claim_scope":"FIXED_WINDOW_PROGRESS_SENSITIVITY","normalized_telemetry_sha256":"bfac8ebdaba48d2a41b1fb793ea30a86814d56ee0973315cffc6431d0bdcd6af","raw_log_sha256":"c77174da6e0003fdefd2d650cd26aa9411db2a914580f01c5640518b87e4c871","schema_version":"AWMA_SIM_CONSUMER_V2","scientific_status":"FORMAL","sim_baseline_id":"SIM_BASELINE_6305c065f2c4913448b0cb61a85d5003030c5917cd37d6a346fd3f42939d5964","sim_evidence_id":"SIM_EVIDENCE_e22c294ffe4ab15a1e602eb3005b5f4c61f346330c6d1b27422194e0d0e47135","sim_input_id":"SIM_INPUT_0ab4e2fe2195d3b7d7da4ee9df6017cbec5c063fcc8110374e1a753f87177634","sim_run_id":"SIM_RUN_4da853270295a97fa52b05bf4c75e06829ccc6e25d67ae73ef56c097bddcbee4"}
